{
  "name": "aws-skills",
  "description": "AWS development with CDK best practices, serverless patterns, cost optimization, and event-driven architecture. Use when deploying to AWS, writing Lambda functions, configuring API Gateway, working with DynamoDB, S3, or any AWS service.",
  "tags": [
    "infrastructure",
    "deployment",
    "python",
    "scaffolding"
  ],
  "sub_skills": [],
  "source": "claude-user",
  "type": "template",
  "depends_on": [],
  "enhances": [
    "mcp-builder"
  ],
  "last_reviewed_at": "2026-10-26",
  "review_score": 60,
  "relevance_tier": "B"
}
