{
  "name": "form-react",
  "description": "Production React form patterns using React Hook Form and Zod for validation, error handling, and accessible form development.",
  "tags": [
    "forms",
    "react",
    "typescript",
    "code-generation"
  ],
  "sub_skills": [],
  "source": "claude-user",
  "type": "template",
  "depends_on": [],
  "enhances": [
    "form-ux-patterns"
  ],
  "last_reviewed_at": "2026-06-06",
  "review_score": 47,
  "relevance_tier": "A"
}
