{
  "name": "forms-router",
  "description": "Routes to 7 specialized form skills based on framework, form type, and requirements including validation, accessibility, security, and UX patterns.",
  "tags": [
    "forms",
    "web",
    "routing"
  ],
  "sub_skills": [
    {
      "name": "accessibility",
      "file": "references/accessibility.md",
      "triggers": [
        "WCAG",
        "ARIA",
        "screen reader",
        "a11y"
      ]
    },
    {
      "name": "validation",
      "file": "references/validation.md",
      "triggers": [
        "zod",
        "schema",
        "validate",
        "error"
      ]
    },
    {
      "name": "security",
      "file": "references/security.md",
      "triggers": [
        "CSRF",
        "XSS",
        "autocomplete",
        "password"
      ]
    },
    {
      "name": "react",
      "file": "references/react.md",
      "triggers": [
        "React",
        "useForm",
        "RHF",
        "TanStack"
      ]
    },
    {
      "name": "vue",
      "file": "references/vue.md",
      "triggers": [
        "Vue",
        "VeeValidate",
        "Vuelidate"
      ]
    },
    {
      "name": "vanilla",
      "file": "references/vanilla.md",
      "triggers": [
        "vanilla",
        "plain JS",
        "no framework"
      ]
    },
    {
      "name": "ux-patterns",
      "file": "references/ux-patterns.md",
      "triggers": [
        "wizard",
        "multi-step",
        "stepper"
      ]
    }
  ],
  "source": "claude-user",
  "type": "router",
  "depends_on": [
    "form-accessibility",
    "form-validation",
    "form-security",
    "form-react",
    "form-vue",
    "form-vanilla",
    "form-ux-patterns"
  ],
  "enhances": [],
  "last_reviewed_at": "2026-08-30",
  "review_score": 69,
  "relevance_tier": "C"
}
