{
  "name": "shader-fundamentals",
  "description": "GLSL shader fundamentals—vertex and fragment shaders, uniforms, varyings, attributes, coordinate systems, built-in variables, and data types. Use when writing custom shaders, understanding the graphics pipeline, or debugging shader code. The foundational skill for all shader work.",
  "tags": [
    "shaders",
    "glsl",
    "code-generation"
  ],
  "sub_skills": [],
  "source": "claude-user",
  "type": "template",
  "depends_on": [],
  "enhances": [
    "shader-noise",
    "shader-sdf",
    "shader-effects"
  ],
  "last_reviewed_at": "2026-10-03",
  "review_score": 66,
  "relevance_tier": "A"
}
