{
  "name": "skill-creator",
  "description": "Guide for creating effective skills that extend Claude's capabilities with specialized knowledge, workflows, or tool integrations.",
  "tags": [
    "meta-tooling",
    "scaffolding"
  ],
  "sub_skills": [],
  "source": "claude-examples",
  "type": "template",
  "depends_on": [],
  "enhances": [
    "router-template"
  ],
  "last_reviewed_at": "2026-10-07",
  "review_score": 72,
  "relevance_tier": "B"
}
