{
  "name": "postfx-composer",
  "description": "EffectComposer setup and architecture for Three.js post-processing pipelines. Use when setting up multi-pass rendering, combining effects, creating custom passes, managing render targets, or building reusable effect stacks. Foundation skill for all post-processing work.",
  "tags": [
    "3d",
    "three.js",
    "code-generation"
  ],
  "sub_skills": [],
  "source": "claude-user",
  "type": "template",
  "depends_on": [],
  "enhances": [
    "postfx-bloom",
    "postfx-effects"
  ],
  "last_reviewed_at": "2026-09-19",
  "review_score": 60,
  "relevance_tier": "A"
}
