{
  "name": "forms-router",
  "description": "Routes form-building requests to the right sub-skill.",
  "tags": ["forms", "validation", "router"],
  "sub_skills": [
    { "name": "react", "file": "references/react.md", "triggers": ["useform", "hook"] }
  ],
  "source": "claude-user",
  "type": "router",
  "depends_on": ["form-validation"],
  "enhances": ["dashboard"],
  "last_reviewed_at": "2026-05-24",
  "review_score": 72,
  "relevance_tier": "B",
  "failure_signatures": ["cargo build cant find crate", "linker cc failed"],
  "cluster_key": "sha1:9f2a4b8c1d3e"
}
