{
  "name": "writing-plans",
  "description": "Use after brainstorming/design phase to create detailed implementation plans. Creates step-by-step plans clear enough for execution by any developer.",
  "tags": [
    "process",
    "planning"
  ],
  "sub_skills": [],
  "source": "claude-user",
  "type": "discipline",
  "depends_on": [
    "subagent-driven-development"
  ],
  "enhances": [
    "subagent-driven-development",
    "brainstorming"
  ],
  "last_reviewed_at": "2026-10-18",
  "review_score": 60,
  "relevance_tier": "B"
}
