{
  "name": "3d-building-advanced",
  "description": "Three.js 3D building system with spatial indexing, structural physics, and multiplayer networking for survival games, sandbox builders, or construction-focused games.",
  "tags": [
    "building-game",
    "3d",
    "three.js",
    "javascript",
    "code-generation"
  ],
  "sub_skills": [
    {
      "name": "multiplayer-networking",
      "file": "references/multiplayer-networking.md",
      "triggers": [
        "localPiece",
        "tempId",
        "Delta Compression",
        "multiplayer-networking",
        "The Networking Challenge",
        "BuildingPermissionSystem",
        "UpdateBatcher",
        "Authority Models",
        "updatePredictions",
        "pending"
      ]
    },
    {
      "name": "performance-at-scale",
      "file": "references/performance-at-scale.md",
      "triggers": [
        "Spatial Data Structures",
        "cy",
        "GPU Instancing",
        "performance-at-scale",
        "createBuildingLOD",
        "SpatialHashGrid",
        "cx",
        "The Scale Problem",
        "ChunkManager",
        "Occlusion Culling"
      ]
    },
    {
      "name": "structural-physics-advanced",
      "file": "references/structural-physics-advanced.md",
      "triggers": [
        "supportStability",
        "Visual Feedback",
        "disconnected",
        "SupportGraph",
        "supports",
        "structural-physics-advanced",
        "onPieceDestroyed",
        "The Physics Spectrum",
        "StabilitySystem",
        "Choosing Your Approach"
      ]
    }
  ],
  "source": "claude-user",
  "type": "template",
  "depends_on": [
    "r3f-fundamentals"
  ],
  "enhances": [
    "structural-physics",
    "terrain-integration"
  ],
  "last_reviewed_at": "2026-10-20",
  "review_score": 75,
  "relevance_tier": "A"
}
