{
  "name": "r3f-fundamentals",
  "description": "React Three Fiber core setup, Canvas configuration, scene hierarchy, camera systems, lighting, render loop, and React integration patterns. Use when setting up a new R3F project, configuring the Canvas component, managing scene structure, or understanding the declarative Three.js-in-React paradigm. The foundational skill that all other R3F skills depend on.",
  "tags": [
    "3d",
    "r3f",
    "react",
    "code-generation"
  ],
  "sub_skills": [],
  "source": "claude-user",
  "type": "template",
  "depends_on": [],
  "enhances": [
    "r3f-geometry",
    "r3f-materials",
    "r3f-drei",
    "r3f-performance"
  ],
  "last_reviewed_at": "2026-09-25",
  "review_score": 72,
  "relevance_tier": "A"
}
