{
  "name": "algorithmic-art",
  "description": "Creating algorithmic art using p5.js with seeded randomness and interactive parameter exploration. Use this when users request creating art using code, generative art, algorithmic art, flow fields, or particle systems.",
  "tags": [
    "3d",
    "shaders",
    "glsl",
    "design"
  ],
  "sub_skills": [],
  "source": "claude-examples",
  "type": "creative-engine",
  "depends_on": [],
  "enhances": [
    "particles-gpu",
    "shader-fundamentals",
    "shader-noise",
    "canvas-design"
  ],
  "last_reviewed_at": "2026-10-21",
  "review_score": 60,
  "relevance_tier": "A"
}
