{
  "name": "pdf",
  "description": "This guide covers essential PDF processing operations using Python libraries and command-line tools. For advanced features, JavaScript libraries, and detailed examples, see REFERENCE.md. If you need to fill out a PDF form, read FORMS.md and follow its instructions. from pypdf import PdfReader, PdfWr",
  "tags": [
    "documentation",
    "python",
    "code-generation"
  ],
  "sub_skills": [],
  "source": "claude-public",
  "type": "template",
  "depends_on": [],
  "enhances": [
    "scientific-documentation"
  ],
  "last_reviewed_at": "2026-09-15",
  "review_score": 66,
  "relevance_tier": "B"
}
