{
  "name": "postfx-bloom",
  "description": "Bloom and glow effects using Three.js UnrealBloomPass with React Three Fiber. Use when implementing glow, bloom, luminance-based effects, selective bloom on specific meshes, or neon/ethereal lighting. Essential for cyberpunk aesthetics, energy effects, magic spells, and UI glow.",
  "tags": [
    "3d",
    "shaders",
    "three.js",
    "code-generation"
  ],
  "sub_skills": [],
  "source": "claude-user",
  "type": "template",
  "depends_on": [
    "postfx-composer"
  ],
  "enhances": [
    "r3f-fundamentals",
    "particles-gpu",
    "audio-reactive"
  ],
  "last_reviewed_at": "2026-09-18",
  "review_score": 60,
  "relevance_tier": "A"
}
