{
  "name": "systematic-debugging",
  "description": "Use when encountering any bug, test failure, or unexpected behavior, before proposing fixes. Implements scientific method for debugging with root cause analysis.",
  "tags": [
    "process",
    "debugging"
  ],
  "sub_skills": [],
  "source": "claude-user",
  "type": "discipline",
  "depends_on": [],
  "enhances": [],
  "last_reviewed_at": "2026-10-12",
  "review_score": 50,
  "relevance_tier": "B"
}
