{
  "name": "internal-comms",
  "description": "Resources for writing internal communications including status reports, leadership updates, 3P updates, company newsletters, FAQs, incident reports, and project updates.",
  "tags": [
    "documentation",
    "content-creation"
  ],
  "sub_skills": [],
  "source": "claude-examples",
  "type": "template",
  "depends_on": [],
  "enhances": [
    "doc-coauthoring"
  ],
  "last_reviewed_at": "2026-09-08",
  "review_score": 54,
  "relevance_tier": "C"
}
