{
  "name": "xlsx",
  "description": "Comprehensive spreadsheet creation, editing, and analysis with support for formulas, formatting, data analysis, and visualization for .xlsx, .xlsm, .csv, and .tsv files.",
  "tags": [
    "documentation",
    "python",
    "code-generation"
  ],
  "sub_skills": [],
  "source": "claude-public",
  "type": "template",
  "depends_on": [],
  "enhances": [
    "d3js-visualization",
    "scientific-documentation"
  ],
  "last_reviewed_at": "2026-10-19",
  "review_score": 60,
  "relevance_tier": "B"
}
